{
  "serverId": "demo-survival",
  "version": "1",
  "gameVersion": "42.8",
  "mods": [
    {
      "id": "mod-a",
      "name": "Demo Mod A",
      "version": "1.0.0",
      "sha256": "e466ba901c684181498e5c3051355fc7a84427bb179ab68762415e0f8ae4a5aa",
      "workshopId": "1234567890",
      "dependencies": []
    }
  ],
  "launchArgs": [],
  "profile": {
    "profileId": "demo-survival"
  }
}
