{
  "serverId": "demo-survival",
  "version": "1",
  "gameVersion": "42.8",
  "mods": [
    {
      "id": "mod-a",
      "name": "Demo Mod A",
      "version": "1.0.0",
      "sha256": "4fbc716b086d0746df8f5c7c04064ef6b0ef30ec8c2b9ea6ff9d7c8222fcb0fd",
      "workshopId": "1234567890",
      "dependencies": []
    }
  ],
  "launchArgs": [],
  "profile": {
    "profileId": "demo-survival"
  }
}
